{
  "schemaVersion": "tabellio-platform/v0.4",
  "codeStorage": {
    "provider": "github",
    "remoteName": "origin",
    "publicSurface": "code-and-thin-pr",
    "codeRef": "refs/heads/main",
    "allowedRefPrefixes": [
      "refs/heads/",
      "refs/tags/"
    ]
  },
  "workflow": {
    "stackManager": "git-spice",
    "controlState": "local",
    "controlProvider": "local",
    "controlRemoteName": null,
    "publishControlRefsToCodeStorage": false,
    "controlRefs": [
      "refs/tabellio/reviews",
      "refs/tabellio/validations",
      "refs/heads/entire/checkpoints/v1"
    ]
  },
  "ledger": {
    "provider": "entire",
    "storage": "local",
    "checkpointRef": "refs/heads/entire/checkpoints/v1"
  },
  "validation": {
    "runner": "tabellio-validate",
    "manifest": "tabellio.validation.json",
    "storage": "local",
    "resultRef": "refs/tabellio/validations"
  },
  "reviews": {
    "provider": "tabellio",
    "storage": "local",
    "stateRef": "refs/tabellio/reviews"
  }
}
